{
  "id": "saturn_house1",
  "kind": "house-overlay",
  "planet": "saturn",
  "house": "1",
  "plainTranslation": "Someone's Saturn in the other's House 1: brings structure into your identity, body, and how you meet the world.",
  "policy": "Governed by synastry-policy. Descriptive, not deterministic; intensity is never treated as obligation, safety concerns override astrology.",
  "note": "Imported from project-authored synastry house overlay matrix material. Source file was not copied into the repository.",
  "voiceNeutral": true,
  "status": "DRAFT"
}
